Phone Name,Display,Front Camera,Rear Camera,RAM,Storage,Battery Capacity,OS,Resolution,Processor,Keywords
Samsung Galaxy S24 Ultra,"6.8"" 1440p OLED",12MP,Quad setup - 108MP main,12GB,256GB,"5,000mAh",Android 13,3200x1440,Snapdragon 8 Gen 3,"premium, flagship, stylus, photography, AI, gaming, professional"
Google Pixel 9 Pro,"6.7"" OLED",11MP,Triple setup - 50MP main,12GB,128GB,"4,926mAh",Android 13,3120x1440,Tensor G4,"AI, computational photography, clean interface, smooth, assistant"
Apple iPhone 16 Pro,"6.1"" OLED",12MP,Triple setup - 48MP main,8GB,256GB,"3,200mAh",iOS 17,2532x1170,A18 Bionic,"premium, ecosystem, security, computational, creative, ProMotion"
OnePlus 12,"6.7"" AMOLED",16MP,Triple setup - 50MP main,12GB,256GB,"5,000mAh",OxygenOS based on Android 13,3216x1440,Snapdragon 8 Gen 3,"speed, gaming, fast charging, cooling, customization"
Google Pixel 9,"6.3"" OLED",10.8MP,Dual setup - 50MP main,8GB,128GB,"4,700mAh",Android 13,2400x1080,Tensor G4,"affordable, computational, clean UI, compact, AI features"
Samsung Galaxy Z Flip 6,"6.7"" Foldable Dynamic AMOLED",10MP,Dual setup - 12MP main,8GB,256GB,"3,700mAh",Android 13,2640x1080,Snapdragon 8+ Gen 2,"foldable, compact, fashion, multitasking, flex"
Google Pixel 9 Pro Fold,"7.6"" Foldable OLED",11MP,Triple setup - 48MP main,12GB,256GB,"4,821mAh",Android 13,2208x1840,Tensor G4,"foldable, productivity, multitasking, large screen, AI"
Nothing 2,"6.55"" OLED",16MP,Dual setup - 50MP main,12GB,256GB,"4,500mAh",Nothing OS based on Android 13,2400x1080,Snapdragon 8+ Gen 2,"transparent, minimalist, unique, glyph interface, clean"
Samsung Galaxy S24,"6.1"" Dynamic AMOLED",10MP,Triple setup - 50MP main,8GB,128GB,"4,000mAh",Android 13,2340x1080,Exynos 2400,"compact, flagship, performance, AI features, premium"
OnePlus 12R,"6.74"" AMOLED",16MP,Triple setup - 64MP main,8GB,128GB,"5,000mAh",OxygenOS based on Android 13,2412x1080,Snapdragon 8 Gen 2,"value, performance, gaming, fast charging, cooling"
Xiaomi 14 Pro,"6.73"" AMOLED",32MP,Triple setup - 50MP main,12GB,256GB,"4,820mAh",MIUI 14 based on Android 13,3200x1440,Snapdragon 8 Gen 3,"photography, fast charging, performance, curved display"
Realme GT Neo 6,"6.74"" AMOLED",16MP,Triple setup - 50MP main,12GB,256GB,"5,000mAh",Realme UI 5.0 based on Android 13,2772x1240,Dimensity 9200+,"gaming, speed, performance, cooling, affordable"
Vivo X100 Pro+,"6.8"" AMOLED",32MP,Quad setup - 50MP main,16GB,512GB,"5,100mAh",OriginOS based on Android 13,3200x1440,Dimensity 9300,"photography, professional, gimbal stabilization, zeiss"
Motorola Edge 40 Pro,"6.67"" OLED",60MP,Triple setup - 50MP main,12GB,256GB,"4,600mAh",Android 13,2400x1080,Snapdragon 8 Gen 2,"clean software, slim, powerful, ready for"
Oppo Find X6 Pro,"6.82"" AMOLED",32MP,Triple setup - 50MP main,16GB,512GB,"5,000mAh",ColorOS based on Android 13,3168x1440,Dimensity 9200+,"camera centric, hasselblad, design, premium"
Honor Magic 6,"6.81"" AMOLED",12MP,Triple setup - 50MP main,12GB,256GB,"4,800mAh",MagicOS based on Android 13,2848x1312,Snapdragon 8 Gen 2,"elegant, AI features, curved display, magic UI"
Asus ROG 7,"6.78"" AMOLED",32MP,Triple setup - 50MP main,16GB,512GB,"6,000mAh",ROG UI based on Android 13,2448x1080,Snapdragon 8 Gen 2,"gaming, triggers, cooling, RGB, high refresh"
Sony Xperia 1 VI,"6.5"" OLED",12MP,Triple setup - 48MP main,12GB,256GB,"5,000mAh",Android 13,3840x1644,Snapdragon 8 Gen 2,"creator, alpha, cinema pro, photography pro"
Huawei P70 Pro,"6.82"" OLED",13MP,Triple setup - 50MP main,12GB,512GB,"4,880mAh",HarmonyOS 4,2720x1260,Kirin 9000S,"XMAGE, innovation, design, harmony"
Redmi K70 Pro,"6.67"" AMOLED",16MP,Triple setup - 200MP main,12GB,256GB,"5,100mAh",MIUI 14 based on Android 13,2712x1220,Dimensity 7200-Ultra,"value, gaming, high resolution, speed"
iQOO 12 Pro,"6.78"" LTPO AMOLED",16MP,Triple setup - 50MP main,16GB,512GB,"4,980mAh",Funtouch OS 14,3200x1440,Snapdragon 8 Gen 3,"gaming, speed, performance, esports"
ZTE Axon 50 Ultra,"6.67"" AMOLED",32MP,Triple setup - 64MP main,12GB,256GB,"4,600mAh",MyOS 13,2400x1080,Snapdragon 8 Gen 2,"under display, clean design, multimedia"
Meizu 21 Pro,"6.79"" AMOLED",32MP,Triple setup - 50MP main,12GB,256GB,"4,800mAh",Flyme 10,2400x1080,Snapdragon 8 Gen 3,"minimalist, flyme, performance, design"
Sharp Aquos R8 Pro,"6.6"" IGZO OLED",12MP,Triple setup - 47MP main,12GB,256GB,"4,570mAh",Android 13,2400x1080,Snapdragon 8 Gen 2,"IGZO display, compact, multimedia"
Tecno Phantom X3,"6.8"" AMOLED",32MP,Triple setup - 50MP main,12GB,256GB,"5,160mAh",HiOS 13,2400x1080,Dimensity 9000+,"retractable portrait lens, design, innovative"
Nubia Red Magic 9 Pro,"7.0"" AMOLED",16MP,Triple setup - 50MP main,16GB,512GB,"6,500mAh",RedMagic OS 9.0,2480x1116,Snapdragon 8 Gen 3,"gaming triggers, active cooling, shoulder buttons, RGB lighting, high refresh"
Black Shark 6 Pro,"6.78"" AMOLED",32MP,Triple setup - 64MP main,16GB,512GB,"5,000mAh",JoyUI 15,2448x1080,Snapdragon 8 Gen 3,"magnetic triggers, liquid cooling, gaming dashboard, pressure sensitive"
Lenovo Legion Y90,"6.92"" AMOLED",44MP,Triple setup - 50MP main,16GB,512GB,"5,600mAh",ZUI 14,2460x1080,Snapdragon 8 Gen 3,"dual turbo fan, gaming optimization, side triggers, virtual RAM"
Infinix Zero 50 Pro,"6.78"" AMOLED",32MP,Triple setup - 108MP main,12GB,256GB,"5,000mAh",XOS 13,2400x1080,Dimensity 9200,"affordable flagship, gaming features, fast charging, curved display"
Poco F6 Pro,"6.67"" AMOLED",16MP,Triple setup - 64MP main,12GB,256GB,"5,160mAh",MIUI 15,2712x1220,Snapdragon 8 Gen 2,"value flagship, liquid cooling, gaming features, high refresh"
TCL Edge 50 Ultra,"6.78"" AMOLED",32MP,Triple setup - 50MP main,12GB,256GB,"4,800mAh",TCL UI 5.0,2652x1200,Snapdragon 8 Gen 2,"NXTVISION, display tech, HDR enhancement, AI upscaling"
Doogee V30 Pro,"6.78"" AMOLED",32MP,Triple setup - 200MP main,12GB,512GB,"5,500mAh",Android 13,2436x1080,Dimensity 9200,"rugged design, thermal imaging, night vision, waterproof"
Nokia X100,"6.78"" AMOLED",32MP,Quad setup - 108MP main,8GB,256GB,"5,000mAh",Android 13,2400x1080,Snapdragon 8 Gen 2,"pure android, durability, ZEISS optics, spatial audio"
Fairphone 5,"6.46"" AMOLED",16MP,Dual setup - 50MP main,8GB,256GB,"4,200mAh",Android 13,2700x1224,Snapdragon 7 Gen 2,"sustainable, modular design, repairable, ethical materials"
AGM Glory G1 Pro,"6.53"" AMOLED",16MP,Triple setup - 48MP main,8GB,256GB,"5,500mAh",Android 13,2340x1080,Dimensity 8200,"thermal camera, night vision, rugged build, waterproof"
Ulefone Power Armor 18T,"6.58"" AMOLED",32MP,Triple setup - 108MP main,12GB,256GB,"9,600mAh",Android 13,2408x1080,Dimensity 9000,"massive battery, thermal imaging, endurance focused, rugged"
Unihertz Tank 3,"7.0"" AMOLED",32MP,Triple setup - 108MP main,12GB,256GB,"22,000mAh",Android 13,2436x1080,Dimensity 8200,"largest battery, rugged design, outdoor focused, laser measure"
CAT S75,"6.6"" AMOLED",8MP,Triple setup - 50MP main,6GB,128GB,"5,000mAh",Android 13,2408x1080,Dimensity 8100,"military grade, thermal imaging, drop proof, work site ready"
Vivo iQOO Neo 9 Pro,"6.78"" AMOLED",16MP,Triple setup - 50MP main,12GB,256GB,"5,160mAh",Funtouch OS 14,2800x1260,Dimensity 9200+,"gaming focused, pressure triggers, cooling system, performance"
Realme GT5 Pro,"6.78"" AMOLED",32MP,Triple setup - 50MP main,16GB,1TB,"5,400mAh",Realme UI 5.0,2780x1264,Snapdragon 8 Gen 3,"performance, storage king, vapor cooling, gaming features"
Samsung Galaxy A75,"6.7"" Super AMOLED",32MP,Quad setup - 108MP main,8GB,256GB,"5,000mAh",Android 14,2400x1080,Snapdragon 7 Gen 3,"midrange champion, camera focused, long updates, reliable"
Xiaomi Redmi Note 13T,"6.67"" AMOLED",16MP,Triple setup - 108MP main,8GB,256GB,"5,000mAh",MIUI 15,2400x1080,Dimensity 8200,"value offering, gaming capable, fast charging, performance"
Google Pixel 9a,"6.1"" OLED",13MP,Dual setup - 64MP main,8GB,128GB,"4,385mAh",Android 14,2400x1080,Tensor G3,"computational photography, clean android, compact size, AI features"
OnePlus Ace 3,"6.74"" AMOLED",16MP,Triple setup - 50MP main,16GB,512GB,"5,500mAh",OxygenOS 14,2772x1240,Snapdragon 8 Gen 3,"performance focus, gaming features, fast charging, curved display"
Motorola Edge 50 Ultra,"6.67"" POLED",60MP,Triple setup - 200MP main,12GB,512GB,"4,600mAh",Android 14,2712x1220,Snapdragon 8 Gen 3,"camera innovation, clean software, gaming ready, premium build"
